{
  "$schema": "../../schema/tool.schema.json",
  "schemaVersion": "1.0.0",
  "slug": "example-hello",
  "name": "Hello Example",
  "shortName": "Hello",
  "summary": "A minimal static browser tool that demonstrates the Engrove Tools folder and metadata contract.",
  "description": "This example provides a small static HTML implementation for validating tool discovery, canonical routing, metadata generation and hub integration.",
  "category": "developer-example",
  "tags": ["example", "html", "static-tool"],
  "keywords": ["Engrove Tools example", "static browser tool example"],
  "entry": "index.html",
  "public": true,
  "hidden": false,
  "language": "en",
  "version": "1.0.0",
  "updated": "2026-07-11",
  "canonicalPath": "/tools/example-hello/",
  "icon": "👋",
  "ogImage": "/assets/tool-default-1200x630.png",
  "robots": "index,follow",
  "capabilities": ["Demonstrates static tool discovery and canonical routing."],
  "inputs": [],
  "outputs": [{"name":"rendered_page","type":"html","description":"A minimal visible browser page."}],
  "whenToUse": ["Use as a repository integration example for a static tool."],
  "whenNotToUse": ["Do not treat this example as an engineering or measurement utility."],
  "limitations": ["The example intentionally contains no substantive calculation or data processing."],
  "privacy": {"processing":"local","storesApplicationUserDataOnServer":false,"requiresAccount":false,"requiresOAuth":false},
  "access": {"cost":"free","registrationRequired":false},
  "claims": {
    "mayClaim": ["This page demonstrates the static tool integration contract."],
    "negativeClaimBoundaries": ["No public backend API is provided."],
    "mustNotClaim": ["This example provides certified measurements."]
  },
  "faq": [{"question":"What is this tool for?","answer":"It is a minimal repository example used to demonstrate how a static tool is published."}],
  "evidence": [{"type":"source","label":"Repository source","url":"https://github.com/Engrove/tools"}],
  "relatedTools": ["cobra-wand"]
}
